DIS_CODE;SUBJECT;RESULT;AUTHOR;KEYWORDS
07.6.6.103.20;Аналитика киберпространства;0;Максим;Анализ социальных сетей, Сетевые метрики, Эгоцентрический сетевой анализ, Социоцентрический сетевой анализ, Источники данных, Визуализация данных, Процессы в сетях, Контент-анализ, Семантический анализ
07.6.6.137.20;Анализ социальных сетей (КР)/ Social Network Analysis (CP);0;Максим;Комплексные сети, Степенные законы распределения, Модель случайных графов, Модель предпочтительного присоединения, Модель малого мира, Сетевые сообщества, Алгоритмы разбиения графа, Сетевые структуры, Двудольные графы, Сети аффилированности
07.6.6.138.20;Методы машинного обучения в культурной аналитике/ Machine Learning Methods in Cultural Analytics;0;Максим;Цели культурной аналитики, Объекты культурной аналитики, Культурные артефакты, Взаимодействие с цифровыми медиа, Онлайн-дискурс, Культурные данные, Культурная информация, Технологии исследования культурных данных, Методы анализа данных
07.7.6.113.20;Инфракрасная фотоника;0;Максим;Инфракрасное излучение, Абсолютно чёрное тело, Законы теплового излучения, Источники излучения, Методы измерения температуры, Тепловое излучение искусственных объектов, Прохождение теплового излучения через атмосферу, Материалы для ИК - области спектра, Оптика тепловизионных систем, Поколения тепловизионной техники, Приёмники теплового излучения, Системы охлаждения приёмников, Физиология зрительного восприятия
07.7.6.72.20;Cпинтроника / Spintronics;0;Максим;Магнитные взаимодействия, Магнитные структуры, Ферромагнитные металлы, Транспорт носителей тока, Гигантское магнитосопротивление, Туннельное магнитосопротивление, Сверхпроводящая спинтроника
07.7.6.83.20;Квантовые коммуникации и сети;0;Максим;Математические основы квантовой информации, Теория сложности квантовых алгоритмов, Квантовые вычисления, Физические источники квантовой информации, Запутанные состояния, Квантовая телепортация, Квантовые блуждания, Квантовые алгоритмы Шора и Гровера, Квантовая криптография, Квантовая метрология, Квантовая статистика, Технологические вопросы создания квантовых компьютеров
07.7.6.88.20;Математические методы фемтосекундной оптики;0;Максим;Оптические технологии передачи, Квантовые технологии передачи, Фемтосекундная оптика, Фемтотехнологии, Оптические линии связи, Квантовые коммуникации, Квантовая информатика,
07.7.6.90.20;Биофотоника;0;Максим;Медицинская фотоника, Методы спектроскопии биологических сред, Коммуникативные технологии, Оптика биотканей, Анализ сложных биофизических сигналов
07.7.6.91.20;Специальные вопросы квантовой информатики;0;Максим;Квантовые алгоритмы, Простейшие симуляторы квантовых алгоритмов, Языки квантового программирования, Экспериментальные системы квантовой криптографии, Элементная база квантовых вычислений, Квантовая метрология
07.7.6.92.20;Материалы оптических, квантовых и фемтотехнологий;0;Максим;Оптические технологии передачи, Квантовые технологии передачи, Фемтосекундная оптика, Фемтотехнологии, Оптические линии связи, Квантовые коммуникации, Квантовая информатика,
07.7.6.93.20;Лазерные конденсированные среды;0;Максим;Лазерные материалы, Энергетика, Оптическая связь, Обработка материалов, Энергетические уровни оптических центров
07.7.6.95.20;Специальные разделы оптического материаловедения;0;Максим;Физика активных оптических материалов, Вращение плоскости поляризации, Механооптические эффекты, Электрооптические эффекты, Магнитооптические эффекты, Нелинейные эффекты, Активные оптические материалы, Элементы фотоники на основе активных оптических материалов
07.7.6.96.20;Инфракрасная фотоника;0;Максим;Инфракрасное излучение, Абсолютно чёрное тело, Законы теплового излучения, Источники излучения, Методы измерения температуры, Тепловое излучение искусственных объектов, Прохождение теплового излучения через атмосферу, Материалы для ИК - области спектра, Оптика тепловизионных систем, Поколения тепловизионной техники, Приёмники теплового излучения, Системы охлаждения приёмников, Физиология зрительного восприятия
07.7.6.97.20;Сенсорная фотоника;0;Максим;Оптические датчики, Волоконные датчики, Сенсоры, Проведение измерений физических величин, Волоконная и волноводная оптика,
07.7.6.98.20;Кремниевая фотоника;0;Максим;Оптические свойства кремниевых планарных волноводов, Нанопористый кремний, Спектроскопия, Оптические маршрутизаторы и сигнальные процессоры,
07.7.6.99.20;Биофотоника / Biophotonics;0;Максим;Медицинская фотоника, Методы спектроскопии биологических сред, Коммуникативные технологии, Оптика биотканей, Анализ сложных биофизических сигналов
