DIS_CODE;SUBJECT;RESULT;AUTHOR;KEYWORDS
06.3.6.217.19;Принципы построения приборов ориентации;0;Максим;Гироскопические системы ориентации, Гироскопические системы пространственной ориентации, Мультиантенная приемная аппаратура, Задача ориентации, Астрономические системы навигации, Астрономические системы ориентации, Спутниковые мультиантенные системы ориентации, Модели погрешностей
06.3.6.218.19;Инерциальные и интегрированные навигационные системы;0;Максим;Метод инерциальной навигации, Matlab, Математические модели погрешностей навигационных систем, Анализ погрешностей навигационных систем, Модели погрешностей современных акселерометров, Имитационное моделирование навигационных систем, Алгоритмы задачи ориентации, Алгоритмы задачи преобразования сигналов акселерометров, Алгоритмы задачи навигации
06.3.6.222.19;Моделирование динамических систем;0;Максим;Проектировании систем автоматического управления, Математические модели систем автоматического управления подвижными объектами, Методы анализа динамических объектов, Методы синтеза динамических объектов, Моделирование систем автоматического управления движением, Matlab, Simulink, Синтез математических моделей динамических объектов
06.3.6.4.18;Системы автоматизированного проектирования;0;Максим;Принципы построения САПР, Автоматизация проектирования технологических процессов, Уровни автоматизации, Оптимизация процессов, Оптимизация технологических операций, Выбор технологического оснащения, Автоматизированное проектирование переходов, Автоматизация процесса управления, Технология «workflow», Адаптивные свойства САПР
06.3.6.49.18;Многопоточное программирование;0;Максим;Оценка производительности при многопоточных вычислениях, Синхронизация потоков, Коллективное соединение, Асинхронное программирование, Распределенные приложения, MapReduce, PyCUDA, Многопоточные вычисления для нейронных сетей, Программирование для GPU
06.3.6.51.18;Формальные языки и грамматики;0;Максим;Формальные языки, Детерминированные конечные автоматы, Недетерминированные конечные автоматы, Регулярные выражения, Иерархия грамматик по Хомскому, Контекстно-свободные грамматики, Нормальная форма Хомского, Структура компилятора, Лексический анализатор, Генератор лексических анализаторов Lex
06.3.6.53.18;Разработка распределённых приложений;0;Максим;Децентрализованная система, Распределенная система, Приложения с использованием параллельных вычислений, Синхронизация памяти при параллельных вычислениях, Использование дедлоков, Использование лайвлоков, Голодание вычислений, Управление конфигурацией распределенного приложения, Использование цепочек блоков
06.3.6.54.18;Реинжиниринг программных систем;0;Максим;SWEBOK, Классификация требований к программной системе, Методология IDEF1X, UML, Эффективность биометрических систем, Arduino, Raspberry Pi, Нейронные сети, Типовые модели неисправностей, Перепроектирование программных систем, Переработка программных систем, Поддержка программных систем
06.3.6.56.18;Экономика программной инженерии;0;Максим;Формы предпринимательской деятельности, Объекты предпринимательской деятельности, Нормативная база предпринимательской деятельности, Предпринимательский риск, Платежные системы в сети Интернет, Электронный маркетинг, Компьютерный бизнес, Информационная безопасность компьютерного бизнеса, SWOT-анализ
06.3.6.57.18;Разработка мультимедйных приложений;0;Максим;MS VisualStudio, Язык программирования C#, Графическая библиотека GDI+, Растровые изображения, Структура библиотек DirectX, Структура библиотек OpenGL, HTML5, CSS, Создания динамических приложений на JS, WebGL, Воспроизведение потокового аудио, Воспроизведение потокового видео
06.3.6.6.18;Проектирование вычислительных систем;0;Максим;Критерии проектирования вычислительных систем, Этапы проектирования вычислительных систем, Выбор технологии проектирования вычислительных систем, Традиционные методик проектирования вычислительных систем, Проектирование на готовой вычислительной платформе, Модульное проектирование, Сквозные технологии проектирования вычислительных систем, Заказное проектирование вычислительных систем, Технологии повторного использования, Надежность проектирования, Инструментальных средств вычислительных систем, Современные тенденции в проектировании вычислительных систем
06.3.6.76.18;Программно-аппаратные средства защиты информации;0;Максим;Система защиты информации от несанкционированного доступа, Подсистема управления доступом, Подсистема регистрации и учета, Подсистема обеспечения целостности, Криптографическая подсистема, Управление ключевой информацией, Сетевая безопасность, Компьютерные вирусы, Защита программного обеспечения от несанкционированного доступа
06.3.6.84.18;Обеспечение информационной безопасности мобильных устройств;0;Максим;Типы уязвимостей мобильных устройств, Обзор особенностей мобильных платформ, Модели разграничения доступа, Изоляция приложений, Джейлбрейк мобильных устройств, Аутентификация пользователей мобильных устройств, Программно-аппаратные средства защиты в мобильных устройствах, Криптографические методы защиты в мобильных устройствах, Криптографические методы защиты в беспроводных системах связи, Типы файловых систем для мобильных устройств, Работа с бэкапами
06.3.6.87.18;Организация и технология защиты информации;0;Максим;Демаскирующие признаки объектов защиты, Способы несанкционированного доступа к источникам информации, Виды угроз безопасности информации, Технические каналы утечки информации, Защита информации от наблюдения, Защита информации от подслушивания, Способы предотвращения утечки информации, Организация защиты информации, Системный подход к защите информации, Методическое обеспечение технической защиты информации
06.3.6.88.18;Организация и управление службой информационной безопасности;0;Максим;Задачи службы защиты информации, Функции службы защиты информации, Структура службы защиты информации, Управление службой защиты информации, Технология управления службой защиты информации
06.3.6.89.18;Организация и защита информации в системе управления базами данных;0;Максим;Системы управления базами данных (СУБД), Встроенные средства защиты данных СУБД, Методы управления удаленным доступом к данным, Средств языка SQL для управления доступом к данным, Уровни средств защиты, Политики безопасности, Встроенные средства разграничения доступа СУБД, Резервное копирование, Защита распределенных хранилищ данных, Комплексная защита баз данных
06.3.6.92.18;Организация обеспечение информационной безопасности мобильных устройств;0;Максим;Типы уязвимостей мобильных устройств, Обзор особенностей мобильных платформ, Модели разграничения доступа, Изоляция приложений, Джейлбрейк мобильных устройств, Аутентификация пользователей мобильных устройств, Программно-аппаратные средства защиты в мобильных устройствах, Криптографические методы защиты в мобильных устройствах, Криптографические методы защиты в беспроводных системах связи, Типы файловых систем для мобильных устройств, Работа с бэкапами
06.6.6.112.20;Анализ культурных данных;0;Максим;Цели культурной аналитики, Объекты культурной аналитики, Культурные артефакты, Взаимодействие с цифровыми медиа, Онлайн-дискурс, Культурные данные, Культурная информация, Технологии исследования культурных данных, Методы анализа данных
06.6.6.113.20;Математические модели исторических процессов;0;Максим;Клиометрика, Вековые циклы, Тысячелетние тренды, Мальтузианские ловушки, Моделирование социальной динамики, Математические модели субкультур, Демографическая динамика, Кондратьевские волны, Модели Мир-системы, Многомерный статистический анализ в исторических исследованиях
06.6.6.90.18;Математические модели исторических процессов;0;Максим;Клиометрика, Вековые циклы, Тысячелетние тренды, Мальтузианские ловушки, Моделирование социальной динамики, Математические модели субкультур, Демографическая динамика, Кондратьевские волны, Модели Мир-системы, Многомерный статистический анализ в исторических исследованиях
06.7.3.1.18;Классическая механика;0;Максим;Статика, Кинематика, Динамика, Анализ механизмов, Износ и смазка, Теория напряженно-деформированного состояния в точке, Кручение и сложное сопротивление стержней, Изгиб балок, Передачи механического движения, Валы и оси, Опоры валов и осей, Подшипники качения и скольжения, Требования к деталям машин
07.0.10.4.20;Бизнес-управление в индустрии обслуживания / Business Administration for Service Industries;0;Максим;Cтратегическое управление в индустрии гостеприимства, Прикладные исследования в индустрии гостеприимства, Организационное поведение, Управление международными гостиничными операциями, Информационные технологии в туризме , Менеджмент международного туризма, Маркетинг туристских дестинаций, Разработка командных стратегий в сфере туризма, Межкультурное взаимодействие в сфере гостеприимства, Правовое регулирование в туризме
07.0.11.2.20;Основы организации международных научных исследований / International Research Management Essentials;0;Максим;Международные наукометрические базы данных, Организация научных исследований, Международные научные парнерства, Научное исследование, Методологические основы научного знания, Правовая охрана интеллектуальной собственности, Управление в сфере науки в России
07.0.12.0.20;Регуляция эмоционального состояния в профессиональной деятельности;0;Максим;Специальные ассистивные средства обучения, Социально-психологической адаптации, Управление временем, Самопознание и самодиагностика, Самореализация и творчество, Мотивация и потребности, Стадии социализации личности, Показатели уверенного поведения, Публичное выступление, Способы саморегуляции, Стрессоустойчивость, Формирование групповой сплоченности
07.0.12.31.20;Системы автоматизированного проектирования / Computer Aided Design;0;Максим;Принципы построения САПР, Автоматизация проектирования технологических процессов, Уровни автоматизации, Оптимизация процессов, Оптимизация технологических операций, Выбор технологического оснащения, Автоматизированное проектирование переходов, Автоматизация процесса управления, Технология «workflow», Адаптивные свойства САПР
07.0.12.4.20;Введение в Linux / Introduction to Linux;0;Максим;Архитектура операционных систем семейства *nix, Задачи операционных систем, Администрирование операционных систем на ядре GNU/Linux, Администрирование процессов, Управление загрузкой операционной системы, Ресурсы вычислительной системы, Принципы организации вычислительной системы, Жизненный цикл процесса (потока), Иерархия процессов в ОС Linux, Мониторинг процессов и потоков, Процессы демоны, Управление приоритетами процессов, Взаимодействие процессов, Установка прикладного программного обеспечения, Настройка прикладного программного обеспечения, Установка программного обеспечения из стандартных репозиториев, Сборка прикладных пакетов из исходного кода, Управление зависимостями
07.0.12.46.20;Аминокислоты, Свойства белков, Функции белков, Ферменты, Нуклеиновые кислоты, Углеводы, Липиды, Витамины, Гормоны, Обмен углеводов, Обмен белков, Обмен аминокислот;0;Максим;Психология как наука, Деятельностный подход в психологии, Строение индивидуальной деятельности человека, Социальная природа сознания, Психология мотивации, Психология эмоций, Индивидуальные особенности человека, Строение личности, Развитие личности, Теории восприятия, Теории мышления, Когнитивная психология
07.1.6.130.20;Технология спирта и крепких алкогольных напитков;0;Максим;Химический состав зернового сырья, Ферментные препараты спиртового производства, Спиртовые дрожжи, Нормативный выход спирта, Схемы водно-тепловой обработки замесов, Расчет ферментных препаратов, Спиртовое брожение, Перегонка и ректификация этилового спирта, Приготовление купажа, Производство ликероводочных изделий, Обеспечения стабильности ликероводочных изделий, Технология водки, Технология крепких алкогольных напитков с выдержкой на дубовой клепке, Технологические схемы получения дистиллятов
07.1.6.132.20;Технология слабоалкогольных, безалкогольных напитков, минеральных вод и кваса;0;Максим;Ассортимент безалкогольных напитков, Ассортимент слаболкогольных напитков, Сырье для производства слабоалкогольных напитков, Сырье для производства безалкогольных напитков, Сырье для производства кваса, Производство сухих напитков, Технология производства кваса, Технология производства безалкогольных напитков, Технология получения колера, Классификация минеральных вод, Обработка минеральных вод, Санитарные требования
07.2.6.38.20;Аддитивные технологии и быстрое производство;0;Максим;Аддитивные технологии, Трехмерное сканирование, Программное обеспечение для обработки полигональных моделей, Реверс инжиниринг, Лазерная гравировка, Компьютерная томография, Быстрое производство, Индустрия 4.0
07.2.6.56.20;Системы автоматизированного проектирования;0;Максим;Принципы построения САПР, Автоматизация проектирования технологических процессов, Уровни автоматизации, Оптимизация процессов, Оптимизация технологических операций, Выбор технологического оснащения, Автоматизированное проектирование переходов, Автоматизация процесса управления, Технология «workflow», Адаптивные свойства САПР
07.2.6.81.20;Системы автоматизированного проектирования;0;Максим;Принципы построения САПР, Автоматизация проектирования технологических процессов, Уровни автоматизации, Оптимизация процессов, Оптимизация технологических операций, Выбор технологического оснащения, Автоматизированное проектирование переходов, Автоматизация процесса управления, Технология «workflow», Адаптивные свойства САПР
07.2.6.97.20;Системы автоматизированного проектирования / Computer Aided Design;0;Максим;Принципы построения САПР, Автоматизация проектирования технологических процессов, Уровни автоматизации, Оптимизация процессов, Оптимизация технологических операций, Выбор технологического оснащения, Автоматизированное проектирование переходов, Автоматизация процесса управления, Технология «workflow», Адаптивные свойства САПР
