DIS_CODE;SUBJECT;RESULT;AUTHOR;KEYWORDS
06.3.6.50.18;Администрирование систем управления базами данных;0;Максим;Физическая организация баз данных, Архитектура СУБД, Процессы конфигурирования СУБД, Профили пользователей в СУБД, Безопасности баз данных, Средства обеспечения целостности баз данных, Аудит систем баз данных, Криптографические средства защиты информации, Конфигурирование сетевых соединений, Средства поддержки высокой готовности систем баз данных
06.0.12.10.18;Электродинамика сплошных сред;0;Максим;Электростатика проводников, Электростатика диэлектриков, Постоянный ток, Постоянное магнитное поле, Квазистационарное магнитное поле, Магнитная гидродинамика, Уравнения электромагнитных волн
06.0.12.11.18;Биохимия клетки;0;Максим;Важнейшие достижения биохимии, Аминокислоты, Свойства белков, Функции белков, Ферменты, Нуклеиновые кислоты, Углеводы, Липиды, Витамины, Гормоны, Обмен углеводов, Обмен белков и аминокислот
06.0.12.16.18;Общая психология;0;Максим;Психология как наука, Деятельностный подход в психологии, Строение индивидуальной деятельности человека, Социальная природа сознания, Психология мотивации, Психология эмоций, Индивидуальные особенности человека, Строение личности, Развитие личности, Теории восприятия, Теории мышления, Когнитивная психология
06.0.12.38.19;Системы автоматизированного проектирования;0;Максим;Принципы построения САПР, Автоматизация проектирования технологических процессов, Уровни автоматизации, Оптимизация процессов, Оптимизация технологических операций, Выбор технологического оснащения, Автоматизированное проектирование переходов, Автоматизация процесса управления, Технология «workflow», Адаптивные свойства САПР
06.0.12.46.19;Электроника;0;Максим;Ток, Напряжение, Сопротивление, Резисторы, Электрическая мощность, Полупроводниковые диоды, Полупроводниковые транзисторы, Датчики температуры, Микросхемы стандартной логики, Микроконтроллеры, Микропроцессоры, Передача информации по цифровым шинам
06.0.12.59.20;Биохимия клетки;0;Максим;Важнейшие достижения биохимии, Аминокислоты, Свойства белков, Функции белков, Ферменты, Нуклеиновые кислоты, Углеводы, Липиды, Витамины, Гормоны, Обмен углеводов, Обмен белков и аминокислот
06.0.5.14.18;Управление карьерой;0;Максим;Смысловая навигация личности, Сферы жизнедеятельности личности., Гармонизации развития личности, Жизненные стратегии и цели, Ресурсная навигация личности, Организационная навигация, Сценарно-ролевая навигация, Профессиональная навигация, Модель эффективного дня, Волевая навигация, Интегральная карта жизненного пути
06.0.5.22.19;Удаленные команды: теория и практика;0;Максим;Виды и функции команд, Технология виртуального командообразования, Интернет-коммуникации, Организация работы виртуальной команды, Контроль работы виртуальной команды, Мотивации работы в виртуальной команде, Требования к участникам виртуальной команды, Формирование командного духа в условиях виртуальной команды
06.0.5.26.19;Управление удаленными командами;0;Максим;Виды и функции команд, Технология виртуального командообразования, Интернет-коммуникации, Организация работы виртуальной команды, Контроль работы виртуальной команды, Мотивации работы в виртуальной команде, Требования к участникам виртуальной команды, Формирование командного духа в условиях виртуальной команды
06.0.6.18.18;Классическая механика;0;Максим;Статика, Кинематика, Динамика, Анализ механизмов, Износ и смазка, Теория напряженно-деформированного состояния в точке, Кручение и сложное сопротивление стержней, Изгиб балок, Передачи механического движения, Валы и оси, Опоры валов и осей, Подшипники качения и скольжения, Требования к деталям машин
06.0.8.19.18;Современные методы бизнес-аналитики;0;Максим;Классификация бизнес-процессов, Принципы процессного подхода, Методология моделирования бизнес-процесса, Контекст моделирования, Показатели бизнес-процесса, Методы анализа бизнес-процесса, Методы совершенствования бизнес-процессов, Бенчмаркинг бизнес-процесса, Реинжиниринг бизнес-процесса
06.1.6.107.18;Технология солода;0;Максим;Сырье для производства солода, Хранение ячменя, Замачивания зерна, Технология проращивания зерна, Регуляторы прорастания, Технология сушки зерна, Сушка солода, Хранение солода, Оценка качества солода
06.1.6.108.18;Технология пива;0;Максим;Сырьевая база для производства пива, Приготовление пивного сусла, Брожение пива, Дображивание пива, Дрожжевое хозяйство пивоваренного завода, Технологическая цепочка стабилизации пива, Розлив пива, Хранение пива, Физико-химический контроль пива
06.1.6.109.18;Технология вин;0;Максим;Сырьевая база для производства вина, Приготовление винного сусла, Брожение вина, Выдержка вина, Дрожжевое хозяйство винодельческого завода, Технологическая цепочка стабилизации вина, Розлив вина, Хранение вина, Физико-химический контроль вина
06.1.6.110.18;Технология безалкогольных напитков, минеральных вод и кваса;0;Максим;Ассортимент безалкогольных напитков, Сырье для производства безалкогольных напитков, Сырье для производства кваса, Производство сухих напитков, Технология производства кваса, Технология производства безалкогольных напитков, Технология получения колера, Классификация минеральных вод, Обработка минеральных вод, Санитарные требования
06.1.6.111.18;Технология спирта;0;Максим;Химический состав зернового сырья, Ферментные препараты спиртового производства, Спиртовые дрожжи, Нормативный выход спирта, Схемы водно-тепловой обработки замесов, Расчет ферментных препаратов, Спиртовое брожение, Перегонка и ректификация этилового спирта
06.1.6.112.18;Технология крепких алкогольных напитков;0;Максим;Приготовление купажа, Производство ликероводочных изделий, Обеспечения стабильности ликероводочных изделий, Технология водки, Технология крепких алкогольных напитков с выдержкой на дубовой клепке, Технологические схемы получения дистиллятов
06.1.6.191.19;Основы биотехнологии;0;Максим;Генная инженерия, Рестрикция, Лигирование, Гель-электрофорез, Плазмиды, Бактериальные штаммы, Полимеразная цепная реакция, Сайт-специфический мутагенез, Биотехнология микроорганизмов, Секвенирование ДНК, Геномные подходы в биоинженерии, Биотехнология растений, Геномное редактирование, Биотехнология животных, Генная терапия, Химический синтез олигонуклеотидов, Синтез генов, Синтез геномов
06.1.6.212.19;Технология солода;0;Максим;Сырье для производства солода, Хранение ячменя, Замачивания зерна, Технология проращивания зерна, Регуляторы прорастания, Технология сушки зерна, Сушка солода, Хранение солода, Оценка качества солода
06.1.6.213.19;Технология пива;0;Максим;Сырьевая база для производства пива, Приготовление пивного сусла, Брожение пива, Дображивание пива, Дрожжевое хозяйство пивоваренного завода, Технологическая цепочка стабилизации пива, Розлив пива, Хранение пива, Физико-химический контроль пива
06.1.6.214.19;Технология вина;0;Максим;Сырьевая база для производства вина, Приготовление винного сусла, Брожение вина, Выдержка вина, Дрожжевое хозяйство винодельческого завода, Технологическая цепочка стабилизации вина, Розлив вина, Хранение вина, Физико-химический контроль вина
06.1.6.215.19;Технология спирта и крепких алкогольных напитков;0;Максим;Химический состав зернового сырья, Ферментные препараты спиртового производства, Спиртовые дрожжи, Нормативный выход спирта, Схемы водно-тепловой обработки замесов, Расчет ферментных препаратов, Спиртовое брожение, Перегонка и ректификация этилового спирта, Приготовление купажа, Производство ликероводочных изделий, Обеспечения стабильности ликероводочных изделий, Технология водки, Технология крепких алкогольных напитков с выдержкой на дубовой клепке, Технологические схемы получения дистиллятов
06.1.6.216.19;Технология кваса и безалкогольных напитков;0;Максим;Ассортимент безалкогольных напитков, Сырье для производства безалкогольных напитков, Сырье для производства кваса, Производство сухих напитков, Технология производства кваса, Технология производства безалкогольных напитков, Технология получения колера, Санитарные требования
06.2.6.103.19;Моделирование динамических систем;0;Максим;Проектировании систем автоматического управления, Математические модели систем автоматического управления подвижными объектами, Методы анализа динамических объектов, Методы синтеза динамических объектов, Моделирование систем автоматического управления движением, Matlab, Simulink, Синтез математических моделей динамических объектов
06.2.6.68.18;Автоматизация проектирования гироскопических приборов (механика);0;Максим;Проектирование механических конструкций современных гироскопических приборов, Методы конечно-элементного анализа компонентов конструкции гироскопических приборов, Creo (Pro/Mechanica), Конструктивная преемственность, Использование САПР для расчета механических характеристик
06.2.6.69.18;Задачи механики подвижных объектов для приборостроения;0;Максим;Методология исследования динамических свойств движений подвижных объектов, Классификация подвижных объектов, Характеристики движений судов различных типов, Управляемость судна, Динамика возмущающих воздействий, Характеристики движений автомобилей, Характеристики движений колесных транспортных средств, Характеристики движений летательных аппаратов
06.2.6.70.18;Принципы построения приборов ориентации;0;Максим;Гироскопические системы ориентации, Гироскопические системы пространственной ориентации, Мультиантенная приемная аппаратура, Задача ориентации, Астрономические системы навигации, Астрономические системы ориентации, Спутниковые мультиантенные системы ориентации, Модели погрешностей
06.2.6.71.18;Современные типы гироскопов;0;Максим;Принцип работы лазера, Лазерный гироскоп, Элементы лазерных гироскопов, Погрешности лазерного гироскопа, Элементы волоконной оптики, Интегрально-оптические схемы, Волоконно-оптический гироскоп, Погрешности волоконно-оптических гироскопов
06.2.6.73.18;Теория колебаний;0;Максим;Колебательные системы, Понятие устойчивости, Гармонические колебания, Потеря устойчивости колебательной системы, Затухающие колебания, Нарастающие колебания, Частотные характеристики, Резонанс, Параметрические колебания, Колебания в консервативных системах, Колебания в диссипативных системах, Автоколебания
06.2.6.74.18;Аппаратные средства цифровой обработки информации;0;Максим;Аналого-цифровое преобразование, Цифро-аналоговое преобразование, Квантование сигнала по уровню, Дискретизация сигнала во времени, Логические устройства, Оперативные запоминающие устройства (ОЗУ), Постоянные запоминающие устройства (ПЗУ), Встраиваемые системы цифровой обработки информации, Проектирование встраиваемых систем
06.2.6.75.18;Пакеты прикладных программ;0;Максим;MathCAD, Matlab, Simulink, LabVIEW, Математическое моделирования работы приборов, Программирование математических задач, Разработка математических моделей, Создание виртуального прибора в LabVIEW, Обработка сигналов в LabVIEW
06.2.6.76.18;Численные методы;0;Максим;Ряд Тейлора, Формула Тейлора, Ряд Маклорена, Формула Маклорена, Теорема Дирихле, Разложение в ряд периодических функций, Ряд Фурье, Интеграл Фурье, Преобразование Фурье, Дискретное преобразование Фурье, Быстрое преобразование Фурье, Методы численного интегрирования, Интерполяционные квадратурные формулы, Методы Рунге-Кутта, Метод Гаусса, Метод Монте-Карло.
06.2.6.79.18;Программирование и основы алгоритмизации;0;Максим;Единая система программной документации (ЕСПД), Этапы проектирования ПО, Структура ПО, Парадигмы программирования, Виды программного обеспечения, Представление алгоритмов, Способы составления контрольных примеров. Верификация программного обеспечения
06.3.6.175.19;Специализированные системы автоматизированного проектирования;0;Максим;Принципы построения САПР, Автоматизация проектирования технологических процессов, Уровни автоматизации, Оптимизация процессов, Оптимизация технологических операций, Выбор технологического оснащения, Автоматизированное проектирование переходов, Автоматизация процесса управления, Технология «workflow», Адаптивные свойства САПР
06.3.6.207.19;Теоретические основы навигации;0;Максим;Кинематические параметры движения объекта, Навигационные системы координат, Физические поля Земли, Картографические проекции, Электронные карты, Электронные-картографические навигационные системы, Методы навигации, Кинематические уравнения вращательного движения твердого тела, Навигационные параметры
06.3.6.208.19;Теория колебаний;0;Максим;Колебательные системы, Понятие устойчивости, Гармонические колебания, Потеря устойчивости колебательной системы, Затухающие колебания, Нарастающие колебания, Частотные характеристики, Резонанс, Параметрические колебания, Колебания в консервативных системах, Колебания в диссипативных системах, Автоколебания
06.3.6.209.19;Пакеты прикладных программ;0;Максим;MathCAD, Matlab, Simulink, LabVIEW, Математическое моделирования работы приборов, Программирование математических задач, Разработка математических моделей, Создание виртуального прибора в LabVIEW, Обработка сигналов в LabVIEW
06.3.6.211.19;Математические основы теории оценивания;0;Максим;Случайные величины, Условная плотность распределения вероятностей, Псевдослучайные последовательности, Метод Монте-Карло, Задачи оценивания, Метод наименьших квадратов (МНК), Метод максимума правдоподобия, Формула Байеса, Линейные оптимальные оценки, Задача комплексной обработки измерений, Фильтр Калмана, Фильтрация случайных процессов
06.3.6.212.19;Испытание навигационных систем и программы обработки экспериментальных данных;0;Максим;Кинематика подвижного основания, Приборы навигации, Методы навигации, Математические модели погрешностей приборов, Испытания приборов навигации, Испытательные стенды, Калибровочные стенды, Обработка результатов испытаний
06.3.6.215.19;Спутниковые навигационные системы;0;Максим;Спутниковые радионавигационные системы (СРНС), Энергетический бюджет спутниковой радионавигационной системы, Принципы расширения спектра, Псевдослучайные последовательности, Структура сигнала спутниковой радионавигационной системы, Передача информационных навигационных сообщений, Приемная аппаратура спутниковой радионавигационной системы, Слежение за сигналами, Альтернативные методы радионавигации
