DIS_CODE;SUBJECT;RESULT;AUTHOR;KEYWORDS
07.3.6.43.20;Технологии моделирования и визуализации трёхмерных сцен;0;Максим;Общие принципы построения трёхмерной сцены, Общие принципы 3D-моделирования объектов, Создание 3D-моделей при помощи сплайнов, Полигональное моделирование, Работа с источниками света, Анимация 3D-объектов, Анимация камер, Текстурирование, Создание текстурных разверток, Композиция 3D-сцены, V-Ray визуализация, Постановка камеры V-Ray Physical Camera, Особенности создания видеопрезентации 3D-сцены
07.3.6.46.20;Современный театр как коммуникационное пространство;0;Максим;Формы и элементы коммуникации, Вербальная и невербальная коммуникация, Театр как форма коммуникации, Коммуникативное пространство, Происхождение театра, Исторические стили театрального искусства, Режиссерский театр, Модерн в театре, Теория постмодернизма, Акционизм как творческая рефлексия социального опыта, Генезис современного постмодернистского театрального дискурса, Современные технические и коммуникационные средства в театре, Постпостмодернизм в театре, Интернет и театр
07.3.6.5.20;Проектирование систем на кристалле (КР);0;Максим;Методологии проектирования систем на кристалле, Маршрут проектирования correct-by-construction, Маршрут проектирования constrained-based design, Принципы высокоуровневого проектирования систем на кристалле, Бизнес модель SIP, Языки описания архитектуры и микроархитектуры систем на кристалле, Высокоуровневый синтез систем на кристалле, Верификация систем на кристалле, Инструментальные средства моделирования систем на кристалле, Инструментальные средства формального анализа систем на кристалле
07.3.6.82.20;Комплексное обеспечение информационной безопасности;0;Максим;Определение условий функционирования комплексной системы защиты информации, Разработка модели комплексной системы защиты информации, Система защиты информации Secret Net, Принципы построения системы защиты информации, Принципы функционирования системы защиты информации, Управление комплексной системы защиты информации в чрезвычайных ситуациях, Нормативно-правовое обеспечение комплексной системы защиты информации, Программно-аппаратное обеспечение комплексной системы защиты информации, Инженерно-техническое обеспечение комплексной системы защиты информации
07.3.6.85.20;Экономика защиты информации;0;Максим;Экономические проблемы защиты информации, Экономическая эффективность защиты информации, Предотвращение ущерба, Виды ущерба наносимого информации, Стоимостная оценка результатов противоправного использования информации, Экономическая эффективность реализации инвестиционных проектов, Страхование как метод защиты информации, Риски в информационной деятельности
07.3.6.86.20;Организация службы информационной безопасности;0;Максим;Задачи службы защиты информации, Функции службы защиты информации, Структура службы защиты информации, Управление службой защиты информации, Технология управления службой защиты информации
07.3.6.89.20;Математическое моделирование объектов и систем;0;Максим;Назначение моделирования, Классификации математических моделей, Этапы построения математической модели, Моделирование на основе аналитических методов, Элементы теории автоматического управления, Моделирование на основе статистических методов, Моделирование на основе теоретико-множественных представлений, Моделирование на основе математической логики, Моделирование на основе математической лингвистики, Моделирование на основе теории графов, Моделирование с использованием представлений о подобии объектов, Моделирование с использованием представлений о подобии функций, Фракталы, Цифорвая обработка сигналов
07.3.6.90.20;Программно-аппаратная защита информации;0;Максим;Система защиты информации от несанкционированного доступа, Подсистема управления доступом, Подсистема регистрации и учета, Подсистема обеспечения целостности, Криптографическая подсистема, Управление ключевой информацией, Сетевая безопасность, Компьютерные вирусы, Защита программного обеспечения от несанкционированного доступа
07.3.6.91.20;Инженерно-техническое обеспечение информационной безопасности;0;Максим;Защита информации с помощью инженерно-технических средств, Технические каналы утечки информации, Демаскирующие признаки сигналов и носителей информации, Подготовка помещений, Средства активной защиты от утечек по виброакустическому каналу, Средства активной защиты от перехвата информации, Средства активной защиты от съема побочных электромагнитных излучений и наводок, Проектирование системы инженерно-технической защиты информации, Организация эксплуатации инженерно-технических средств защиты информации, Контроль эффективности защиты информации техническими средствами
07.3.6.93.20;Технические средства противодействию промышленному шпионажу;0;Максим;Организация информационной безопасности, Уровни промышленного шпионажа, Объекты промышленного шпионажа, Субъекты промышленного шпионажа, Принципы взаимодействия государства и бизнеса, Формирование общих режимов противодействия промышленному шпионажу, Основные каналы утечки информации, Выявление частных случаев промышленного шпионажа, Мониторинг защищенности предприятия от промышленного шпионажа, Меры противодействия промышленному шпионажу
07.4.6.107.20;Основы научной визуализации и визуального сторителлинга;0;Максим;Визуальные средста для коммуникации, Когнитивные особенности восприятия визуальной информации, Таксономия техник научной визуализации, Мультимедийный и графический сторителлинг в науке, Принципы использования движения, Принципы использования цвета, Сценарии визуализации, Моделирование визуальных сцен, Методы компьютерной графики, Методы вычислительной геометрии, Визуализация научных и инженерных расчетов, Визуализация научной информации, Анализ научной информации, Современные технологии визуализации
07.4.6.108.20;Кураторство в научных музеях и центрах популяризации науки;0;Максим;Научно-технологические музеи и центры, Язык научной музеологии, Задачи научного музея, Научно-техническое наследие, Философские основания музейных практик, Научно-исследовательская деятельность в музее, Музейная педагогика, Кураторство, Музейные концепции, Оценки эффективности музейной деятельности, Структура научной выставки, Музейные решения
07.4.6.17.20;Управление ресурсами инновационно-активного предприятия;0;Максим;Планирование развития инновационно-активного предприятия, Инновационное партнерство, Риски инновационно-активных предприятий, Управление персоналом инновационно-активного предприятия, Управление финансовыми ресурсами инновационно-активных компаний, Бухгалтерский учет инновационных предприятий, Налогообложение инновационных предприятий, Административный ресурс, Нематериальные активы предприятия
07.4.6.19.20;Экономический анализ;0;Максим;Содержание экономического анализа, Законы функционирования систем в экономическом анализе, Жизненный цикл изделия, Методы экономического анализа, Анализ объемов производства и продаж продукции, Основные средства, Анализ оборотных средств, Анализ материальных ресурсов, Анализ трудовых ресурсов, Анализ расходов на производство и продажу продукции, Анализ финансовых результатов, Анализ финансового состояния предприятия, Экономический анализ инвестиционной деятельности предприятия, Комплексная оценка деятельности предприятия
07.4.6.21.20;Венчурные инвестиции;0;Максим;Система финансирования инновационной деятельности, Жизненный цикл инновации, Модели финансирования инноваций, Основные источники финансирования инновационной деятельности, Особенности финансирования высокотехнологичных предприятий, Специфика венчурного финансирования, Методы финансирования инноваций, Классификация форм проектного финансирования, Формы долевого проектного финансирования, Формы смешанного проектного финансирования, Долговое финансирование инновационных проектов
07.4.6.88.20;Управление инновациями;0;Максим;Технологические инновации, Управление производственным процессом, Функционально-стоимостной анализ, Организация инновационных процессов на основе TQM, Ресурсный потенциал инновации, оценка инновационных проектов, Ресурсосберегающие технологии, Бережливое производство, Планирование ресурсного обеспечения, Методы выявления проблем в технологическом процессе, Оценка инновационного потенциала организации
07.4.6.90.20;Маркетинговое проектирование инноваций;0;Максим;Поиск рыночных возможностей реализации инновационных проектов, Маркетинговый анализ инновационных проектов, Маркетинговая экспертиза реализации инновационного проекта, Особенности продвижения инновационного проекта, Эффективность реализации инновационных проектов, Управление маркетингом инновационных проектов, Организация маркетинга инновационных проектов, Стратегический анализ направлений развития инновационных проектов, Планирование коммуникационных стратегий продвижения инновационных проектов, Формирование маркетингового бюджета реализации инновационного проекта, Составление маркетинговой программы продвижения инновационных проектов, Оценка эффективности реализации маркетинговой программы продвижения инновационных проектов
07.4.6.91.20;Коммерциализация и продвижение инноваций;0;Максим;Инновационный товар, Анализ наукоемкой продукции, Конкурентоспособность нововведений, Восприятия инноваций, Эффективность маркетингового продвижения инновационных товаров, Управления маркетингом инновационных товаров, Особенности продвижения инновационного товара, Показатели оценки эффективности реализации маркетинговой программы, Формы организации сервиса инновационных товаров, Методы ценообразования на наукоемкую продукцию, Методы прогнозирования сбыта наукоемкой продукции, Каналы сбыта наукоемкой продукции
07.5.6.16.20;Квантовые когнитивные технологии систем искусственного интеллекта / Quantum Cognitive Technologies of AI Systems;0;Максим;Методология квантовой физики, Логическая формулировка квантовой теории, Квантовая теории за пределами физики, Квантовая логика в процессе принятия решений, Моделирование когнитивных процессов с помощью квантовой теории, Квантовоподобная семантика языка, Искусственный интеллект на квантовых принципах, Квантово-подобные фазовые переходы в ансамблях когнитивных систем, Кооперативное поведение, Квантовая топология
07.5.6.18.20;Машинное обучение и искусственный интеллект / Machine Learning and Artificial Intelligence;0;Максим;Признаковое описание задачи, Проблема переобучения, Методы отбора признаков, Методы оценки качества алгоритмов, Линейная регрессия, Метод ближайших соседей, Линейные методы классификации, Байесовская теория классификации, Нейронные сети, Композиция алгоритмов, Алгоритмы кластеризации данных, Поиск ассоциативных правил, Рекомендательные системы, Работа с библиотекой Pandas, Работа с библиотекой Numpy, Библиотека scikit-learn, Визуализация данных
07.5.6.32.20;Математические модели комплексов программ;0;Максим;Назначение UML, Элементы модели: сущности и отношения, Канонические диаграммы, Моделирование использования, Моделирование структуры, Диаграмма классов, Диаграмма компонентов, Диаграмма размещения, Моделирование поведения, Диаграмма состояний, Диаграмма деятельности, Диаграммы взаимодействия, Диаграмма последовательности, Диаграммы коммуникации, Моделирование параллелизма, Типовые подходы к проектированию, Влияние UML на процесс разработки
07.5.6.53.20;Формальные языки;0;Максим;Формальные языки, Детерминированные конечные автоматы, Недетерминированные конечные автоматы, Регулярные выражения, Иерархия грамматик по Хомскому, Контекстно-свободные грамматики, Нормальная форма Хомского, Структура компилятора, Лексический анализатор, Генератор лексических анализаторов Lex
07.5.6.58.20;Обработка речи;0;Максим;Временные ряды, Статистические характеристики временных рядов, Модели временных рядов, Фильтрация временных рядов, Кратковременный анализ речевых сигналов, Кратковременный спектральный анализ сигналов, Искажения речевого сигнала, Алгоритмы обработки речевых сигналов, Эквалайдеры, Коррекция спектра, Кепстральный анализ, Выделение речевого сигнала на фоне шума
07.5.6.72.20;Анализ акустических событий (КР);0;Максим;Временные ряды, Статистические характеристики временных рядов, Модели временных рядов, Фильтрация временных рядов, Кратковременный анализ речевых сигналов, Кратковременный спектральный анализ сигналов, Искажения речевого сигнала, Алгоритмы обработки речевых сигналов, Эквалайдеры, Коррекция спектра, Кепстральный анализ, Выделение речевого сигнала на фоне шума
07.5.6.73.20;Распознавание речи;0;Максим;Речеобразование, Слуховая система, Речевосприятие, Метод динамического программирования для распознавания речи, Получение MFCC признаков, Марковские процессы в задаче распознавания речи, Распознавание естественной речи, Долговременные признаки, Речевые декодеры, Обучение контекстнонезависимых моделей фонем, Обучение контекстнозависимых моделей фонем, Метод Витерби, Оценка качества распознавания речи
07.5.6.77.20;Аудиоаналитика (КР);0;Максим;Временные ряды, Статистические характеристики временных рядов, Модели временных рядов, Фильтрация временных рядов, Кратковременный анализ речевых сигналов, Кратковременный спектральный анализ сигналов, Искажения речевого сигнала, Алгоритмы обработки речевых сигналов, Эквалайдеры, Коррекция спектра, Кепстральный анализ, Выделение речевого сигнала на фоне шума
07.5.9.0.20;Программирование на языке Python / Programming in Python;0;Максим;Чтение данных из различных источников, Чтение данных разных форматов, Работа с API различных веб-ресурсов, Jupyter Notebook, Работа с библиотекой Pandas, Работа с библиотекой Numpy, Очистка данных, Визуализация данных с помощью Matplotlib, Построение интерактивных графиков с помощью библиотеки plotly, Библиотека sklearn, Задачи машинного обучения
07.6.6.102.20;Введение в финансовую математику;0;Максим;Математика кредита, Анализ потоков платежей, Стохастические модели денежных потоков, Модели страхования, Эконометрические модели финансовых рынков, Процентные расчеты, Кривые доходности, Финансовые ренты, Барьерные значения экономических показателей, Диверсификация инвестиций, Эффективность инвестиций, Исчисление опционов
